[
  {
    "id": "SUB.WORLD_INFORMATION",
    "label": {
      "en": "World / Information",
      "ro": "Lume / Informație"
    },
    "description": {
      "en": "Events, claims, evidence, truth state and context.",
      "ro": "Evenimente, afirmații, dovezi, starea adevărului și context."
    },
    "implementation_status": "partial"
  },
  {
    "id": "SUB.HUMAN_AGENT",
    "label": {
      "en": "Human Agent",
      "ro": "Agent uman"
    },
    "description": {
      "en": "Memory, reliability estimates, heuristics, judgment, confidence, metacontrol and action.",
      "ro": "Memorie, estimări de fiabilitate, euristici, judecată, încredere, metacontrol și acțiune."
    },
    "implementation_status": "partial"
  },
  {
    "id": "SUB.SOURCES_INSTITUTIONS",
    "label": {
      "en": "Sources / Institutions",
      "ro": "Surse / Instituții"
    },
    "description": {
      "en": "Sources, experts, institutions, reliability and provenance.",
      "ro": "Surse, experți, instituții, fiabilitate și proveniență."
    },
    "implementation_status": "partial"
  },
  {
    "id": "SUB.MEDIA_STRATEGIC_ACTORS",
    "label": {
      "en": "Media / Strategic Actors",
      "ro": "Media / Actori strategici"
    },
    "description": {
      "en": "Editorial outlets, TV, online press, framing, agenda and strategic propagation.",
      "ro": "Redacții, televiziuni, presă online, framing, agendă și propagare strategică."
    },
    "implementation_status": "partial"
  },
  {
    "id": "SUB.PLATFORM_NETWORK",
    "label": {
      "en": "Platform / Network",
      "ro": "Platformă / Rețea"
    },
    "description": {
      "en": "Ranking, exposure, reach, norms, amplification and network structure.",
      "ro": "Ranking, expunere, reach, norme, amplificare și structură de rețea."
    },
    "implementation_status": "future"
  },
  {
    "id": "SUB.AI_SYSTEM",
    "label": {
      "en": "AI System",
      "ro": "Sistem AI"
    },
    "description": {
      "en": "AI responses, reliability, sycophancy, delegation and reliance.",
      "ro": "Răspunsuri AI, fiabilitate, sycophancy, delegare și reliance."
    },
    "implementation_status": "future"
  },
  {
    "id": "SUB.LEARNING_ADAPTATION",
    "label": {
      "en": "Learning / Adaptation",
      "ro": "Învățare / Adaptare"
    },
    "description": {
      "en": "Skill, habit, trust learning, deskilling and slow change.",
      "ro": "Competență, obicei, învățarea încrederii, pierderea competenței și schimbări lente."
    },
    "implementation_status": "future"
  },
  {
    "id": "SUB.OBSERVATION_VALIDATION",
    "label": {
      "en": "Observation / Validation",
      "ro": "Observație / Validare"
    },
    "description": {
      "en": "What is measured, observation error, validation targets and derived outputs.",
      "ro": "Ce este măsurat, eroarea de observație, țintele de validare și ieșirile derivate."
    },
    "implementation_status": "active"
  }
]
